CATEGORY	BIBTEXKEY	ADDRESS	ANNOTE	AUTHOR	TITLE	TITLE_TRANSLATION	BOOKTITLE	BOOKTITLE_TRANSLATION	CHAPTER	CROSSREF	EDITION	EDITOR	HOWPUBLISHED	INSTITUTION	JOURNAL	KEY	MONTH	NOTE	NUMBER	ORGANIZATION	PAGES	PUBLISHER	SCHOOL	SERIES	TYPE	VOLUME	YEAR
incollection	plungian2010	Berlin/New York	NA	Plungian, Vladimir A.	Types of verbal evidentiality marking: an overview	NA	Linguistic realization of evidentiality in {E}uropean languages	NA	NA	NA	NA	Diewald, Gabriele and Smirnova, Elena	NA	NA	NA	NA	NA	NA	NA	NA	15--58	De Gruyter Mouton	NA	NA	NA	NA	2010
incollection	forker2018a	Oxford	NA	Forker, Diana	Evidentiality in {N}akh-{D}aghestanian languages	NA	The {O}xford {H}andbook of {E}videntiality	NA	NA	NA	NA	Aikhenvald, Alexandra Y.	NA	NA	NA	NA	NA	NA	NA	NA	490--509	Oxford University Press	NA	NA	NA	NA	2018
incollection	tatevosov2007	Saint Petersburg	NA	Татевосов, С. Г.	Эвиденциальность и адмиратив в багвалинском языке	Evidentiality and admirative in Bagvalal	Эведенциальность в языках Европы и Азии: сборник статей памяти Натальи Андреевны Козинцевой	Evidentiality in languages of Europe and Asia: Volume in memoriam N. A. Kozintseva	NA	NA	NA	Храковский, В. С.	NA	NA	NA	NA	NA	NA	NA	NA	351--397	Наука	NA	NA	NA	NA	2007
book	uslar1889	Tiflis	NA	Uslar, P.K.	Аварский язык	Avar	NA	NA	NA	NA	NA	NA	NA	NA	NA	NA	NA	NA	NA	NA	NA	Управление Кавказского Учебнаго Округа	NA	NA	NA	NA	1889
article	verhees2019a	NA	NA	Verhees, Samira	Defining evidentiality	NA	NA	NA	NA	NA	NA	NA	NA	NA	Вопросы языкознания	NA	NA	NA	6	NA	113--133	NA	NA	NA	NA	NA	2019
book	chafenichols1986	Norwood, NJ	NA	Chafe, Wallace and Nichols, Johanna	Evidentiality: {T}he linguistic coding of epistemology	NA	NA	NA	NA	NA	NA	NA	NA	NA	NA	NA	NA	NA	NA	NA	NA	Ablex	NA	NA	NA	NA	1986
incollection	authiermaisak2011	Bochum	NA	Authier, Gilles and Maisak, Timur	Introduction	NA	Tense, aspect, modality and finiteness in {E}ast {C}aucasian	NA	NA	NA	NA	Authier, Gilles and Maisak, Timur	NA	NA	NA	NA	NA	NA	NA	NA	vii--xii	Universitätsverlag Dr. N. Brockmeyer	NA	NA	NA	NA	2011
incollection	danielmaisak2018	Moscow	NA	Даниэль, Михаил А. and Майсак, Тимур А.	“Черная кошка грамматикализации"": конструкции с глаголом ‘найти’ в дагестанских яызках	“The black cat of grammaticalization”: constructions with the verb ‘find’ in {E}ast {C}aucasian	{ЕВР}ика! {С}борник статей о поисках и находках к юбилею {Е}. {В}. {Р}ахилиной	EVReka! Volume about the search and its findings dedicated to {E}. {V}. Rakhilina	NA	NA	NA	Рыжова Д. А. and Добрушина, Н. Р. and Бонч-Осмоловская, А. А. and Выренкова, А. С. and Кюсева, М. В. and Орехов, Б. В.	NA	NA	NA	NA	NA	NA	NA	NA	120--152	Лабиринт	NA	NA	NA	NA	2018
