CATEGORY	BIBTEXKEY	AUTHOR	TITLE	YEAR	TITLE_TRANSLATION	PUBLISHER	ADDRESS	PAGES	BOOKTITLE	BOOKTITLE_TRANSLATION	EDITOR	JOURNAL	NOTE	NUMBER	SCHOOL	URL	VOLUME	CONTRIBUTOR	COMMENT
phdthesis	khalilova2009	Khalilova, Zaira	A grammar of Khwarshi	2009	NA	NA	NA	NA	NA	NA	NA	NA	NA	NA	University of Leiden	NA	NA	Anastasia Panova	NA
article	authier2010	Authier, Gilles	Azeri morphology in Kryz (East Caucasian)	2010	NA	NA	NA	14--42	NA	NA	NA	Turkic Languages	NA	NA	NA	NA	14	Anastasia Panova	NA
book	forker2020dargwa	Forker, Diana	A grammar of Sanzhi Dargwa	2020	NA	Language Science Press	Berlin	NA	NA	NA	NA	NA	NA	NA	NA	https://langsci-press.org/catalog/book/249	NA	Anastasia Panova	NA
book	isaev2001	Исаев, Мамогед-Шапи А.	Русско-даргинский словарь	2001	Russian-Dargwa dictionary	Институт истории, языка и литературы им. Г. Цадасы	Makhachkala	NA	NA	NA	NA	NA	NA	NA	NA	NA	NA	Anastasia Panova	NA
book	alekseevetal2012	Алексеев, Михаил Е. and Атаев, Борис Махаевич and Магомедов, Магомед Абдулкадирович and Магомедов, Магомед Ибрагимович and Мадиева, Гюльжаган Исмаиловна and Саидова, Патимат Абдулаевна and Самедов, Джалиль Самедович	Современный аварский язык	2012	Contemporary Avar language	Aleph	Makhachkala	NA	NA	NA	NA	NA	NA	NA	NA	NA	NA	Anastasia Panova	NA
unpublished	maisakpanovadraft	Maisak, Timur and Anastasia Panova	An intragenetic typology of caritive markers in Nakh-Daghestanian	2021	NA	NA	NA	NA	NA	NA	NA	NA	NA	NA	NA	NA	NA	Anastasia Panova	NA
article	oskolskayaetal2020	Оскольская, С. А. and Заика, Н. М. and Клименко, С. Б. and Федотов, М. Л.	Определение каритива как сравнительного понятия	2020	Defining caritive as a comparative concept	NA	NA	7--25	NA	NA	NA	Вопросы языкознания	NA	NA	NA	NA	3	Anastasia Panova	NA
book	dum-tragut2009	Dum-Tragut, Jasmine	Armenian	2009	NA	John Benjamins	Amsterdam/Philadelphia	NA	NA	NA	NA	NA	NA	NA	NA	NA	NA	NA	NA
